{
	"id": "cache_basic",
	"description": "Crawling with disk cache enabled succeeds without errors",
	"tags": ["cache"],
	"skip": {
		"languages": ["wasm", "c"],
		"reason": "requires mock HTTP server"
	},
	"input": {
		"mock_responses": [
			{
				"path": "/",
				"headers": {
					"content-type": "text/html"
				},
				"body_inline": "<html><body><h1>Cached</h1></body></html>"
			}
		],
		"config": {}
	},
	"assertions": [
		{
			"type": "equals",
			"field": "status_code",
			"value": 200
		}
	]
}
