{
  "id": "scrape_image_sources",
  "description": "Extracts images from img, picture, og:image, twitter:image",
  "tags": [
    "scrape",
    "images"
  ],
  "input": {
    "config": {},
    "mock_responses": [
      {
        "status_code": 200,
        "headers": {
          "content-type": "text/html; charset=utf-8"
        },
        "body_file": "html/image_sources.html"
      }
    ]
  },
  "assertions": [
    {
      "type": "equals",
      "field": "status_code",
      "value": 200
    },
    {
      "type": "greater_than",
      "field": "images.length",
      "value": 4
    },
    {
      "type": "equals",
      "field": "og.image",
      "value": "https://example.com/images/og-hero.jpg"
    }
  ]
}
